"Category","Marks","Question","Answer"
"వారాలు-నెలలు","200","నెలకి గల మరొక పేరు 'మా' తో మొదలవుతుంది. ఏమిటి?","నెలకి గల మరొక పేరు మాసం"
"వారాలు-నెలలు","200","నెలలు ఎన్ని ఉన్నాయి?","నెలలు పన్నెండు ఉన్నాయి"
"వారాలు-నెలలు","200","తెలుగు నక్షత్రాలలో మొదటి నక్షత్రం ఏది?","తెలుగు నక్షత్రాలలో మొదటి నక్షత్రం అశ్వని"
"వారాలు-నెలలు","200","ఈ బొమ్మ రోజులో ఎప్పుడు తీసి ఉండవచ్చు?","ఈ బొమ్మ సంధ్యాసమయంలో / సాయంకాలంలో తీసి ఉండవచ్చు"
"వారాలు-నెలలు","200","లక్షీవారం, రవివారం అని పయే వారాలని అంటారు?","లక్షీవారం అంటే గురువారం, రవివారం అంటే ఆదివారం"
"వారాలు-నెలలు","200","వరలక్ష్మి వ్రతం ఏ మాసంలో ఏ వారం రోజున చేసుకుంటారు?","శ్రావణమాసం, శుక్రవారం"
"వారాలు-నెలలు","300","వారంలో నాలుగవ రోజు పేరేమిటి?","వారంలో నాలుగవ రోజు బుధవారం"
"వారాలు-నెలలు","300","సోమవారానికి ఎల్లుండి ఏ వారం అవుతుంది?","సోమవారానికి ఎల్లుండి బుధవారం అవుతుంది"
"వారాలు-నెలలు","300","శుక్ల, కృష్ణ పక్షాలు కలిపితే ఎన్ని రోజులు ఉంటాయి?","శుక్ల, కృష్ణ పక్షాలు కలిపితే 30 రోజులు"
"వారాలు-నెలలు","300","ఒక గంటకి ఎన్ని క్షణాలు?","ఒక గంటకి 3600 క్షణాలు"
"వారాలు-నెలలు","400","ఒక నెలలో ఎన్ని పక్షాలు ఉంటాయి?","ఒక నెలలో రెండు పక్షాలు ఉంటాయి"
"వారాలు-నెలలు","400","తెలుగు నెలలలో మొదటి నెల ఏమిటి?","తెలుగు నెలలలో మొదటి నెల చైత్రము"
"వారాలు-నెలలు","400","సంక్రాంతి జనవరి నెలలో వస్తుంది?","సంక్రాంతి జనవరి నెలలో వస్తుంది"
"వారాలు-నెలలు","400","అమావాస్యకి ముందు, పౌర్ణమి ముందు వచ్చే తిథి ఏమిటి?","అమావాస్యకి ముందు, పౌర్ణమి ముందు వచ్చే తిథి చతుర్దశి"
"వారాలు-నెలలు","400","ఉగాది ఏ తెలుగు నెలలో వస్తుంది?","ఉగాది చైత్రంలో వస్తుంది"
"వారాలు-నెలలు","400","హేమంత ఋతువు ఏ తెలుగు మాసాలలో వస్తుంది?","హేమంత ఋతువు మార్గశిర మరియు పుష్యమాసాలలో వస్తుంది"
"వారాలు-నెలలు","500","తెలుగు నెలలలో మొదటి నెల పేరు ఏమిటి?","తెలుగు నెలలలో మొదటి నెల చైత్రము"
"వారాలు-నెలలు","500","తెలుగు నెలల ప్రకారం ఒక తెలుగు సంవత్సరం ఆంగ్ల సంవత్సరం కంటే 11 1/4 రోజులు తక్కువ. ఈ రోజులను కలుపుకుని ఎక్కువ చేసే నెలను ఏమని పిలుస్తారు?","అధిక మాసం లేదా మైల మాసం"
"వారాలు-నెలలు","500","ఈరోజు శనివారమైతే మొన్న ఏ వారము? ఎల్లుండి ఏ వారము?","ఈరోజు శనివారమైతే మొన్న గురువారం, ఎల్లుండి సోమవారం"
"వారాలు-నెలలు","500","కొత్తగా పెళ్లయిన వీళ్ళిద్దరూ ఆకాశంలో ఏ నక్షత్రం చూస్తున్నారు?","కొత్తగా పెళ్లయిన వీళ్ళిద్దరూ ఆకాశంలో అరుంధతి నక్షత్రం చూస్తున్నారు"
"వారాలు-నెలలు","500","బృహస్పతి వారం అని ఏ వారాన్ని పిలుస్తారు?","బృహస్పతి వారం అంటే గురువారం"
"వారాలు-నెలలు","500","ఈ రోజు తిథి పౌర్ణమి. చంద్రుడు మృగశిర నక్షత్రంలో ఉన్నాడు. ఈ మాసం పేరు ఏమిటి?","మార్గశిరం / మార్గశీర్షం"
"వారములు","100","ఎన్ని రోజులు అయితే ఒక వారం అవుతుంది?","ఏడు రోజులు అయితే ఒక వారం అవుతుంది"
"వారములు","100","ఒక వారంలో ఎన్ని గురువారాలు వస్తాయి?","ఒక వారంలో ఒక గురువారం మాత్రమే వస్తుంది"
"వారములు","200","బుధవారానికి ఒక రోజు ముందు రోజు ఏది?","బుధవారానికి ఒక రోజు ముందు మంగళవారం"
"వారములు","200","46562)/ - మంగళవారం, ౧గ౮2)/ - శుక్రవారం అని తెలుగులో చెప్పండి?","46562)/ - మంగళవారం, ౧గ౮2)/ - శుక్రవారం"
"వారములు","300","గురువారం ఒక రోజు తరువాత ఏ రోజు?","గురువారం ఒక రోజు తరువాత శుక్రవారం"
"వారములు","300","రేపు బుధవారం అయితే మొన్న ఏ వారం?","రేపు బుధవారం అయితే మొన్న ఆదివారం"
"వారములు","400","ఒక మాసంలో ఎన్ని వారాలు ఉంటాయి?","ఒక మాసంలో నాలుగు వారాలు ఉంటాయి"
"వారములు","400","ఈ రోజు శనివారం అయితే ఆవల ఎల్లుండి ఏ వారం?","ఈ రోజు శనివారం అయితే ఆవల ఎల్లుండి మంగళవారం"
"వారములు","500","“0౧౦౧౦౪౫”, "02)/ తీగం! 70[౧౧0గ౦౪/ తెలుగులో చెప్పండి","0౧౦౧౧౦౪/- రేపు. 02)/ - ఎల్లుండి"
"వారములు","500","నిన్నకు నిన్నని ఏమని పిలుస్తారు?","నిన్నకు నిన్నని మొన్న అని పిలుస్తారు"
"వాతావరణం","100","ఎండలు ఎక్కువగా ఏ బుతువులో కాస్తాయి?","ఎండలు ఎక్కువగా గ్రీష్మ బుతువులో"
"వాతావరణం","200","కాలముల పేర్లు ఏమిటి?","వేసవి కాలము, వర్షా కాలము, మరియు చలి కాలము"
"వాతావరణం","300","చెట్లు ఏ బుతువులో చిగురిస్తాయి?","చెట్లు వసంత బుతువులో"
"వాతావరణం","400","మంచు ఏ బుతువులో కురుస్తుంది?","చలి బుతువులో మంచు కురుస్తుంది"
"వాతావరణం","500","ఏ బుతువులో వర్షాలు ఎక్కువగా కురుస్తాయి?","వర్ష బుతువులో వర్షాలు ఎక్కువగా కురుస్తాయి"
"వస్తువులు","100","౧6€- దీనిని తెలుగులో పమంటారు?","౧6€ ని తెలుగులో వల అంటారు."
"వస్తువులు","100","01౬ - తెలుగులో ఏమంటారు?","01౬ ని తెలుగులో నూనె అంటారు."
"వస్తువులు","100","పుస్తకంలో వ్రాసుకోవడానికి ఏ వస్తువు ఉపయోగిస్తారు? (తెలుగులో చెప్పాలి)","పుస్తకంలో వ్రాసుకోవడానికి కలము ఉపయోగిస్తారు."
"వస్తువులు","100","చెట్టు, చెక్క నరకటానికి ఏ వస్తువు ఉపయోగిస్తారు?","చెట్టు, చెక్క నరకటానికి గొడ్డలి లేదా రంపము ఉపయోగిస్తారు."
"వస్తువులు","100","ఒరలో కత్తి పెట్టుకోవడానికి ఏ వస్తువు ఉపయోగిస్తారు?","ఒరలో కత్తి పెట్టుకోవడానికి బర ఉపయోగిస్తారు."
"వస్తువులు","100","చిత్రంలోని వస్తువును తలపై ఎక్కడ ధరిస్తారు?","తలపై ధరిస్తారు."
"వస్తువులు","200","ఛత్రము - ఇంగ్లీషు పేరు చెప్పండి?","ఛత్రము - Umbrella."
"వస్తువులు","200","ఈ బొమ్మలో కనిపించే వస్తువు ఏమిటి?","కత్తెర."
"వస్తువులు","200","ఈ బొమ్మలో ఉన్న వస్తువుని తెలుగులో ఏమంటారు?","దువ్వెన."
"వస్తువులు","200","ఇంటికి తాళం ఎందుకు వేస్తారు?","భద్రత కోసం."
"వస్తువులు","200","ఏ వస్తువు తో జుట్టు దువ్వుకుంటారు?","దువ్వెన/పన్ని తో."
"వస్తువులు","200","వేడిగా ఉన్న పాత్రలను పట్టుకోవడానికి ఏ వస్తువు ఉపయోగిస్తారు?","పట్టే వస్తువు - దస్తానాలు."
"వస్తువులు","300","౪/2110!00% ని ఎక్కడ పెడతారు?","గోడకు పెడతారు."
"వస్తువులు","300","దోసెలు వెయ్యడానికి ఏ ఇనప వస్తువుని ఉపయోగిస్తారు?","పెనం."
"వస్తువులు","300","౮4౧ ని తెలుగులో ఏమంటారు?","తుపాకి."
"వస్తువులు","400","గోడలో మేకులు కొట్టడానికి సాధారణంగా ఏ వస్తువు వాడతారు?","సుత్తి/సమ్మెట."
"వస్తువులు","400","చిరిగిన బట్టలు కుట్టడానికి ఏ వస్తువులు కావాలి?","సూది, దారము."
"వస్తువులు","500","దోశలకు పెనంతో పాటుగా ఏ వస్తువు అవసరం?","అట్లకాడ."
"వస్తువులు","500","పొలము దున్నటానికి వాడే వస్తువు ఏది?","నాగలి."
"వస్తువులు","500","చేనేత వృత్తిలో వాడే ఒక వస్తువు పేరు చెప్పండి?","రాట్నము/మగ్గము."
"వస్తువులు","500","పక్షులని దేనిలో ఉంచి బంధిస్తారు?","పంజరం."
"వస్తువులు","500","గోడకి మేకులు కొట్టడానికి కావాల్సిన పరికరం ఏమిటి?","సుత్తి."
"వస్తువులు","500","దిక్సూచి ని ఆంగ్లంలో ఏమంటారు?","Compass."
"వస్తువులు-వచనాలు","100","నదులు. దీనికి పకవచనం చెప్పండి.","నది."
"వస్తువులు-వచనాలు","200","మనిషికి బహువచనం చెప్పండి.","మనుషులు."
"వస్తువులు-వచనాలు","300","ఒకటి కన్న ఎక్కువ వస్తువులను తెలిపే వచనాన్ని ఏమంటారు?","బహువచనం."
"వస్తువులు-వచనాలు","400","రాయికి బహువచనం ఏమిటి?","రాళ్ళు."
"వస్తువులు-వచనాలు","500","కవికి బహువచనం చెప్పండి.","కవులు."
"వస్తువులు-పనులు","100","ఈ చిత్రంలోని వస్తువును దేనికి ఉపయోగిస్తారు?","ఆ వస్తువుని నడవడానికి/కాళ్ళకి ఉపయోగిస్తారు."
"వస్తువులు-పనులు","100","కలంతో ఏం చేస్తారు?","కలంతో రాసుకుంటారు."
"వస్తువులు-పనులు","100","ఈ బొమ్మలో కనిపిస్తున్న వస్తువు ఏమిటి?","బుట్ట."
"వస్తువులు-పనులు","100","ఈ బొమ్మలో కనిపిస్తున్న వస్తువు ఏమిటి, దాంతో ఏం చేసారు?","కలం. కలంతో వ్రాస్తారు."
"వస్తువులు-పనులు","100","ఈ బొమ్మలో కనిపిస్తున్న వస్తువు దేనికి ఉపయోగపడుతుంది?","నడవడానికి/పరుగెత్తడానికి ఉపయోగపడుతుంది."
"వస్తువులు-పనులు","100","వానాకాలంలో ఎక్కువగా వాడే వస్తువు ఏది?","గొడుగు."
"వస్తువులు-పనులు","100","ఈ బొమ్మలో కనిపిస్తున్న వస్తువు పేరు ఏమిటి?","గొడుగు."
"వస్తువులు-పనులు","200","పుస్తకంలో వ్రాయడానికి ఏం కావాలి?","కలం/పెన్సిలు."
"వస్తువులు-పనులు","200","బట్టలు ఉతకడానికి ఏ వస్తువు వాడతారు?","సబ్బు."
"వస్తువులు-పనులు","200","ఈ బొమ్మలో కనిపిస్తున్న వస్తువు ఏమిటి?","సుత్తి."
"వస్తువులు-పనులు","200","ఈ వస్తువు ఏమిటి? దేనికి వాడతారు?","కళ్ళజోళ్ళు, చూడడానికి."
"వస్తువులు-పనులు","200","పుస్తకంతో ఏం చెయ్యవచ్చు?","పుస్తకం చదవవచ్చు, అందులో వ్రాయవచ్చు."
"వస్తువులు-పనులు","200","భూమి దున్నడానికి వాడే వస్తువు ఏమిటి?","నాగలి."
"వస్తువులు-పనులు","200","చెట్లకి నీళ్ళు దేనితో పడతారు?","గొట్టం."
"వస్తువులు-పనులు","300","ఈ చిత్రంలోని వస్తువు ఏమిటి? దానిని వంటింట్లో దేనికి ఉపయోగిస్తారు?","కత్తి, పండ్లు/కూరగాయలు కోయడానికి."
"వస్తువులు-పనులు","300","గిన్నెలు/పాత్రలు కడగటానికి ఏ వస్తువు వాడతారు?","సబ్బు."
"వస్తువులు-పనులు","300","వరి/పొలంలో మొక్కలు కోయడానికి వాడే వస్తువు ఏమిటి?","కొడవలి."
"వస్తువులు-పనులు","300","పడుకోవడానికి రెండు వస్తువులు కావాలి, అవి ఏవి?","మంచం, పరుపు."
"వస్తువులు-పనులు","300","మనం కూర్చోవడానికి వాడే రెండు వస్తువులు చెప్పండి?","కుర్చీ, బల్ల."
"వస్తువులు-పనులు","300","పాత్రలకు ఇంకొక పేరు చెప్పండి?","గిన్నెలు."
"వస్తువులు-పనులు","300","పొలాలలో పంట కోయడానికి వాడే ఈ వస్తువుని ఏమంటారు?","కొడవలి."
"వస్తువులు-పనులు","400","గుర్రంతో లాగే బండిని ఏమంటారు?","రథం."
"వస్తువులు-పనులు","400","సూదితో ఏం చేస్తారు?","బట్టలు/దండలు కుడతారు."
"వస్తువులు-పనులు","400","చేపలు పట్టడానికి వాడే చిన్న ఇనుప కోకిని ఏమంటారు?","గాలం."
"వస్తువులు-పనులు","400","ఈ బొమ్మలో కనిపిస్తున్న వస్తువు ఏమిటి?","రాట్నం."
"వస్తువులు-పనులు","400","బాణాలు వేయడానికి వాడే వస్తువు ఏమిటి?","విల్లు."
"వస్తువులు-పనులు","400","బావిలో నీళ్ళు తోడడానికి వాడే వస్తువు ఏమిటి?","బొక్కెన."
"వస్తువులు-పనులు","400","బావిలోని నీటిని బొక్కెనతో పైకి లాగడాన్ని ఏమంటారు?","తోడడం/చేదడం."
"వస్తువులు-పనులు","500","ఈ చిత్రంలోని వస్తువు ఏమిటి? దానిని దేనికి ఉపయోగిస్తారు?","చీపురు, చెత్త ఊడవడానికి/తుడవడానికి."
"వస్తువులు-పనులు","500","మెట్లు ఎక్కకుండా పైకి వెళ్లడానికి దేనిని ఉపయోగిస్తారు?","లిఫ్ట్."
"వస్తువులు-పనులు","500","బాణాలు వేయడానికి వాడే వస్తువు ఏమిటి?","విల్లు."
"వస్తువులు-పనులు","500","బట్టలు కుట్టడానికి ఏ వస్తువు వాడతారు?","కుట్టయంత్రం/కుట్టు మషీన్."
"వస్తువులు-పనులు","500","ఈ బొమ్మలో కనిపిస్తున్న వస్తువు దేనికి వాడతాము?","కారు, ప్రయాణానికి."
"వస్తువులు-పనులు","500","పెనం మీద దోశలు తీయడానికి వాడే వస్తువు ఏమిటి?","అట్లకాడ."
"వస్తువులు-పనులు","500","మహర్షులు నీటిని ఉంచే పాత్ర పేరు ఏమిటి?","కమండలం."
"వత్తులు-గుణింతాలు","100","జల్చార్టో ____ ఈ పదంలో “యో" కి ఏ గుణింతం వుంది?","యోకి 'ఓ' గుణింతం వుంది."
"వత్తులు-గుణింతాలు","200","తెలుగు అక్షరమాలలో ఉన్న సంయుక్తాక్షరము ఏమిటి?","క్ష (క్ష)"
"వత్తులు-గుణింతాలు","300","ర బత్తుకి ఇంకో పేరు ఏమిటి?","ర - 'రిఫ్‌'."
"వత్తులు-గుణింతాలు","400","ఠ కి పూర్జానుస్వారం జోడిస్తే ఏమి వస్తుంది?","ఠం"
"వత్తులు-గుణింతాలు","500","“భఅంతుకరణ” --- ఈ పదంలో "తొ" పక్కన ఉన్న గుణింతము గుర్లు పేరు ఏమిటి?","తొకి 'ఒ' గుణింతము."
"వంటలు","100","660 ఓ౬62%/ '౪666120163' ని తెలుగులో పమంటారు?","ఆకు కూరలు/కూరాకు"
"వంటలు","200","పూజలో భాగంగా దేవుడికి పెట్టే వంటకాలని పమంటారు?","ప్రసాదం/నైవేద్యం"
"వంటలు","300","అరిసెలు/అతిరసాలు/నిప్పట్లు ఏ పిండితో చేస్తారు?","బియ్యం పిండి"
"వంటలు","400","పోపు వేయడానికి వాడే ద్రవ పదార్థం ఏమిటి?","నూనె/నెయ్యి"
"వంటలు","500","రాత్రి మిగిలిపోయిన అన్నం మరునాడు తింటాం కదా! ఆ అన్నాన్ని పమంటారు?","చద్దన్నం/సదన్నం"
