"Category","Marks","Question","Answer"
"సూర్యకుటుంబం","100","సూర్య కుటుంబంలో భూమి సూర్యుడి నుండి ఎన్నో గ్రహం?","భూమి సూర్యుడి నుండి మూడో గ్రహం"
"సూర్యకుటుంబం","200","సూర్య కుటుంబంలో అన్నిటికన్నా పెద్ద గ్రహం ఏది? తెలుగు పేరు చెప్పాలి","సూర్య కుటుంబంలో అన్నిటికన్నా పెద్ద గ్రహం గురుడు లేక బృహస్పతి"
"సూర్యకుటుంబం","300","సూర్యుడికి అతి దగ్గిరగా ఉన్న గ్రహం ఏమిటి? తెలుగు పేరు చెప్పాలి","సూర్యుడికి అతి దగ్గిరగా ఉన్న గ్రహం బుధుడు"
"సూర్యకుటుంబం","400","గ్రహాలలో మామూలుగా చాలా ప్రకాశవంతంగా కనిపించే గ్రహం ఏది? తెలుగు పేరు చెప్పాలి","గ్రహాలలో మామూలుగా చాలా ప్రకాశవంతంగా కనిపించే గ్రహం శుక్ర గ్రహం"
"సూర్యకుటుంబం","500","భారత దేశము !2/5 గ్రహానికి పంపిన యంత్రాన్ని భారతీయ భాషల్లో పమంటారు?","భారత దేశము !2/5 గ్రహానికి పంపిన యంత్రాన్ని మంగల్‌ యాన్‌ అంటారు"
"సుమతిశతకం","100","తలగ నటల","చెఅకుగడ రుచి తియ్యగా ఉంటుంది."
"సుమతిశతకం","100","శతకంలో సాధారణంగా ఎన్ని పద్యాలు ఉంటాయి?","శతకంలో సాధారణంగా వంద లేదా నూట ఎనిమిది పద్యాలు ఉంటాయి."
"సుమతిశతకం","200","అలయం వబీలయ వదం మేబిడి కొరవ అవుతాయి?","చీమలు పెట్టిన పుట్టలు పాములకు నివాసం అవుతాయి."
"సుమతిశతకం","200","చీమలు పెట్టిన","చీమలు పెట్టిన పుట్టలు."
"సుమతిశతకం","300","హేమము - అర్ధం చెప్పండి.","హేమము - అర్ధం -బంగారం."
"సుమతిశతకం","300","మావటి వాడెక్కినట్లు","మావటి వాడెక్కినట్లు మహిలో సుమతీ."
"సుమతిశతకం","400","ఖలునకు నిలువెల్ల పముంటుంది?","ఖలునకు నిలువెల్ల విషము ఉంటుంది."
"సుమతిశతకం","400","సుమతి శతకం ఎవరు రచించారు?","సుమతి శతకం బద్దెన రచించారు."
"సుమతిశతకం","500","నీళ్లలోన మొసలి నిగిడి","నిళ్లలొన ముసలి నిగద 'వనుగు' పట్టు."
"సుమతిశతకం","500","వెలయంగా దోక నుండు వృశ్చికమునకున్‌. వృశ్చికము అంటే ఏమిటి?","వృశ్చికము అంటే తేలు."
"సాహిత్యం","100","'115460౧7' ను తెలుగులో ఏమంటారు?","'11560౧/”' ను తెలుగులో 'చరిత్ర' అంటారు."
"సాహిత్యం","200","'My Experiments with Truth' వ్రాసినది ఎవరు?","'My Experiments with Truth' వ్రాసినది మహాత్మా గాంధీ గారు."
"సాహిత్యం","200","మా తెలుగుతల్లికి మల్లె పూదండ ఎవరు రాశారు?","మా తెలుగుతల్లికి మల్లె పూదండ వ్రాసిన వారు: శంకరంబాడి సుందరాచారి."
"సాహిత్యం","300","సాహిత్యంలో నోబెల్‌ బహుమతి వచ్చిన భారతీయుడు ఎవరు?","సాహిత్యంలో నోబెల్‌ బహుమతి వచ్చిన భారతీయుడు 'ఠాగోర్‌ / రజీంద్రనాథ్‌ ఠాగోర్‌ / రవీంద్రనాథ్‌ ఠాగోర్‌.'"
"సాహిత్యం","300","తెలుగులో ఆదికవి అని ఎవరిని అంటారు?","తెలుగులో ఆదికవి అని నన్నయని అంటారు."
"సాహిత్యం","400","'నేను సైతం ప్రపంచాగ్నికి సమిధ నొక్కటి ఆహుతిచ్చాను!' - అని వ్రాసింది ఎవరు?","'నేను సైతం ప్రపంచాగ్నికి సమిధ నొక్కటి ఆహుతిచ్చాను!' - అని వ్రాసింది శ్రీ శ్రీ (శ్రీరంగం శ్రీనివాసరావు)."
"సాహిత్యం","400","'దేశమును ప్రేమించుమన్నా' మొదటి నాలుగు వరసలు చెప్పండి.","మంచియన్నది పెంచుమన్నా/వట్టిమాటలు కట్టిపెట్టోయ్‌/గట్టిమేల్‌ తలపెట్టవోయ్‌."
"సాహిత్యం","500","కాళిదాసు రచించిన ముఖ్యమైన నాటకాలలో ఒకటి చెప్పండి?","కాళిదాసు రచించిన ముఖ్యమైన నాటకాలు: మాళవికాగ్నిమిత్రము, విక్రమోర్వశీయము మరియు అభిజ్ఞాన శాకుంతలము."
"సాహిత్యం","500","అవధానం లో ఏకాగ్రతను భంగ పరచడానికి మధ్య మధ్యలో మాట్లాడే పృచ్చకుడిని పమంటారు?","అవధానం లో ఏకాగ్రతను భంగ పరచడానికి మధ్య మధ్యలో మాట్లాడే పృచ్చకుడిని అప్రస్తుత ప్రసంగి అంటారు."
"సామెతలు","100","పిట్ట కొంచెం సామెతను పూరించండి.","పిట్ట కొంచెం కూత ఘనం."
"సామెతలు","100","'పొరుగింటి........... కి రుచెక్కువ' సామెతని పూరించండి.","పొరుగింటి పులకూరకి రుచెక్కువ."
"సామెతలు","100","కుక్క కాటుకి చెప్పేది ఏమిటి?","కుక్క కాటుకి చెప్పు దెబ్బ."
"సామెతలు","100","ఈ సామెతను పూరించండి: కుక్క తోక?","కుక్క తోక వంకర."
"సామెతలు","200","కుక్క కాటుకి?","కుక్క కాటుకి చెప్పు దెబ్బ."
"సామెతలు","200","అత్తలేని ఉత్తమురాలు","అత్తలేని ఉత్తమురాలు."
"సామెతలు","200","దూరపు కొండలు ఎలా ఉంటాయి?","దూరపు కొండలు నునుపుగా ఉంటాయి."
"సామెతలు","200","ఈ చిత్రం ఉన్న సామెత గుర్తించండి?","ఈ చిత్రంలో ఉన్న సామెత: ఇంట్లో పిల్లి, వీధిలో పులి."
"సామెతలు","300","దూరపు కొండలు ఎలా ఉంటాయి?","దూరపు కొండలు నునుపుగా ఉంటాయి."
"సామెతలు","300","అత్త మీద కోపం దీని మీద చూపించిందని సామెత.","అత్త మీద కోపం దుత్త మీద చూపించిందని సామెత."
"సామెతలు","300","పిట్ట కొంచెం సామెతను పూరించండి.","పిట్ట కొంచెం కూత ఘనం."
"సామెతలు","300","ఈ చిత్రంలో ఉన్న సామెత: ఒక దెబ్బకు రెందు పిట్టలు.","ఒక దెబ్బకు రెండు పిట్టలు."
"సామెతలు","400","మింగ మెతుకు లేదు మీసానికి నూనె.","మింగ మెతుకు లేదు మీసాలకి సంపెంగ నూనె."
"సామెతలు","400","'గంతకు తగ్గ' అనే సామెత.","గంతకు తగ్గ బలవంతుడు."
"సామెతలు","400","మింగ మెతుకు లేదు మీసానికి నూనె.","మింగ మెతుకు లేదు మీసాలకి సంపెంగ నూనె."
"సామెతలు","400","ఈ సామెతను పూరించండి; దూరపు?","దూరపు కొండలు నునుపు."
"సామెతలు","500","మెరిసేదంతా ఏమి కాదు?","మెరిసేదంతా మేలిమి/బంగారం కాదు."
"సామెతలు","500","హనుమంతుని ముందు ఈ గంతులు వేసినట్టు అని ఒక సామెత.","హనుమంతుని ముందు కుప్పి గంతులు వేసినట్టు."
"సామెతలు","500","మెరిసేదంతా?","మెరిసేదంతా మేలిమి/బంగారం కాదు."
"సామెతలు","500","ఈ చిత్రంలో ఉన్న సామెత: చెవిటి వాది ముందు శంఖం ఊదినట్లు.","చెవిటి వాది ముందు శంఖం ఊదినట్లు."
"సరిదిద్దండి","100","ఒకటి, రండు, నాలుగు, ఐదు.. సరి చేసి చెప్పండి.","ఒకటి, రెండు, మూడు, నాలుగు, ఐదు."
"సరిదిద్దండి","200","ఈ చిత్రంలో ఉన్నది 'పటక'. సరి చేసి చెప్పండి.","ఈ చిత్రంలో ఉన్నది 'పలక'."
"సరిదిద్దండి","300","'అమెరికా రాజధాని వాషింగ్రన్‌ రాష్ట్రంలో ఉన్నది.' - సరిచేసి చెప్పండి.","అమెరికా రాజధాని వాషింగ్రన్‌ డి.సి. ఇది రాష్ట్రం కాదు. రాజధాని నగరం మాత్రమే."
"సరిదిద్దండి","400","'ఉసిరికాయ తియ్యగా ఉంటుంది'. ఉసిరి రుచి సరియైనదా? లేకపోతే ఏమిటి అసలు రుచి?","కాదు, ఉసిరికాయ పుల్లగా, వగరుగా ఉంటుంది."
"సరిదిద్దండి","500","'సీత మొన్న వరంగల్‌ వెళ్తాడు' - ఈ వాక్యాన్ని సరిదిద్దండి.","సీత మొన్న వరంగల్‌ వెళ్ళింది / సీత రేపు వరంగల్‌ వెళ్తుంది."
"సమయం","100","రోజులో చంద్రుడు సాధారణంగా ఎప్పుడు కనిపిస్తాడు?","రోజులో చంద్రుడు సాధారణంగా రాత్రి భాగంలో కనిపిస్తాడు."
"సమయం","200","నిముషానికి ఎన్ని క్షణాలు? తెలుగులో చెప్పండి.","నిముషానికి అరవై క్షణాలు."
"సమయం","300","రోజుకు ఎన్ని గంటలు? తెలుగులో చెప్పండి.","రోజుకు ఇరవై నాలుగు గంటలు."
"సమయం","400","ఒక గంటలో ఎన్ని క్షణాలు ఉంటాయి?","ఒక గంటలో 3600 క్షణాలు ఉంటాయి."
"సమయం","500","సూర్య నమస్కారం ఎప్పుడు చేస్తారు?","ప్రొద్దున / సూర్యోదయం అప్పుడు చేస్తారు."
"సంఘసంస్కర్తలు","100","ఈశ ప్రముఖుడు ఎవరు?","ఈశ ప్రముఖుడు శ్రీ ద్రామతానికి చెందిన సంఘసంస్కర్త."
"సంఘసంస్కర్తలు","200","ఈ చిత్రము లోని సంఘ సంస్కర్త మలాలా యూసఫ్‌జూయ్‌.","మలాలా యూసఫ్‌జూయ్‌"
"సంఘసంస్కర్తలు","300","ఈ చిత్రము లోని వ్యక్తి గొప్ప సంఘ సంస్కర్త . ఆయన పేరు చెప్పండి.","ఈ చిత్రము లోని వ్యక్తి: 0/. అంబేద్కర్‌"
"సంఘసంస్కర్తలు","400","వితంతువులకు తిరిగి పెళ్ళి చెయ్యవచ్చు అంటూ పోరాడిన తెలుగు సంఘసంస్కర్త ఎవరు?","వితంతువులకు తిరిగి పెళ్ళి చెయ్యవచ్చు అంటూ పోరాడిన తెలుగు సంఘసంస్కర్త శ్రీ కందుకూరి వీరేశలింగం గారు"
"సంఘసంస్కర్తలు","500","రామ్‌ రహీమ్‌ ఏక్‌ హై - అంటే హిందూ ముస్లిం ఒక్కటే అని చెప్పిన కవి, ఈ చిత్రంలో చూపిన సంఘసంస్కర్త ఎవరు?","రామ్‌ రహీమ్‌ పక్‌ హై - అని చెప్పిన కవి, సంఘసంస్కర్త ; కబీర్‌ దాస్‌."
"సంఘంలోవ్యక్తులు","100","బడిలో చదువు చెప్పేది ఎవరు?","గురువు"
"సంఘంలోవ్యక్తులు","100","౧౦|106ని తెలుగులో పమంటారు?","రక్షకభటులు"
"సంఘంలోవ్యక్తులు","100","ఈ చిత్రంలోని వ్యక్తి పేరు ఏమిటి?","గాంధీజీ"
"సంఘంలోవ్యక్తులు","100","బొమ్మలు గీసేవారిని తెలుగులో ఏమంటారు?","చిత్రకారుడు / చిత్రకారిణి"
"సంఘంలోవ్యక్తులు","100","బంగారు ఆభరణాలు చేసే వాడు ఎవరు?","కంసాలి/స్వర్ణకారుడు"
"సంఘంలోవ్యక్తులు","100","మగ్గంపై చేసే వృత్తిపనిని ఏమని అంటారు?","చేనేతవృత్తి"
"సంఘంలోవ్యక్తులు","100","దేశంకోసం యుద్ధంలో పోరాడేవారు ఎవరు?","సైనికులు"
"సంఘంలోవ్యక్తులు","100","'స్నేహితుడు' అంటే ఆంగ్లంలో ఏమంటారు?","Friend"
"సంఘంలోవ్యక్తులు","200","తోటలో మొక్కలు చూసుకునేవాడు ఎవరు?","తోటమాలి"
"సంఘంలోవ్యక్తులు","200","బట్టలు కుట్టే వ్యక్తిని ఏమంటారు?","దర్జీ / దర్జిపని చేసే వ్యక్తి"
"సంఘంలోవ్యక్తులు","200","అమెరికా అధ్యక్షుడు ఎవరు?","బరాక్‌ ఒబామా"
"సంఘంలోవ్యక్తులు","200","కవిత్వం చెప్పే వారిని తెలుగులో ఏమంటారు?","కవులు / కవయిత్రులు"
"సంఘంలోవ్యక్తులు","200","ఈ బొమ్మలోని వృత్తి పని చేసేవారు ఎవరు?","కుమ్మరి"
"సంఘంలోవ్యక్తులు","200","పద్యాలు, పాటలు, కవితలు వ్రాసేవారిని ఏమంటారు?","పాటల రచయిత(త్రి) / కవి(యిత్రి)"
"సంఘంలోవ్యక్తులు","200","నదులపై ఆనకట్ట కట్టేవాడు ఎవరు? ఆంగ్లములో చెప్పవచ్చు.","ఇంజనీరు"
"సంఘంలోవ్యక్తులు","200","ఉపాధ్యాయుడు తరగతిలో పిల్లలకు ఏమి చేస్తారు?","విద్య నేర్పుతారు"
"సంఘంలోవ్యక్తులు","300","జుట్టు కత్తిరించే వారిని ఏమంటారు?","మంగలి"
"సంఘంలోవ్యక్తులు","300","ఛాయాచిత్రాలను తీసే వారిని ఏమంటారు? ఆంగ్లంలో చెప్పవచ్చు.","ఫొటోగ్రాఫర్‌"
"సంఘంలోవ్యక్తులు","300","పుస్తకం చదివే వారిని ఏమంటారు?","పాఠకులు"
"సంఘంలోవ్యక్తులు","300","౧65166౧ ను తెలుగులో ఏమంటారు?","అధ్యక్షుడు / రాష్ట్రపతి"
"సంఘంలోవ్యక్తులు","400","ఆరోగ్య సమస్యలు తీర్చే వ్యక్తి ఎవరు?","వైద్యుడు"
"సంఘంలోవ్యక్తులు","400","వడ్రంగి చేసే పని ఏమిటి?","కొయ్యపని"
"సంఘంలోవ్యక్తులు","400","భారత ప్రథమ ప్రధాని ఎవరు?","జవహర్ లాల్ నెహ్రూ"
"సంఘంలోవ్యక్తులు","400","'౧౧౪ ను తెలుగులో ఏమంటారు?","వంటపెద్ద / వంటవాడు"
"సంఘంలోవ్యక్తులు","400","నాటకం / సినిమా చూస్తున్నవారిని ఏమంటారు?","ప్రేక్షకులు"
"సంఘంలోవ్యక్తులు","400","వృత్తిపరంగా ఎవరిని అన్నదాత అని అంటారు?","వ్యవసాయదారుడు / రైతు"
"సంఘంలోవ్యక్తులు","400","వడ్రంగి దేనితో వస్తువులు తయారు చేస్తాడు?","చెక్క / ఉలి / ఛిత్రి"
"సంఘంలోవ్యక్తులు","500","గుడిలో పూజ చేయించేది ఎవరు?","పూజారి"
"సంఘంలోవ్యక్తులు","500","నేతాజీ అని ఎవరిని అంటారు?","సుభాష్ చంద్ర బోస్"
"సంఘంలోవ్యక్తులు","500","బస్సు, రైలు, విమానం వంటి వాహనాల్లో టిక్కెట్‌ కొనుక్కుని ఒబకచోటి నుండి మరొక చోటికి వెళ్ళేవారిని ఏమంటారు?","ప్రయాణీకులు"
"సంఘంలోవ్యక్తులు","500","చెక్క పని చేసేవారిని ఏమంటారు?","వడ్రంగి"
"సంఘంలోవ్యక్తులు","500","సమాధానం ఒప్పు లేదా తప్పు అని నిర్ణయించే వారిని ఏమంటారు?","న్యాయనిర్దేశకుడు / న్యాయాధికారి"
"సంఘంలోవ్యక్తులు","500","నావ / పడవ నడిపేవారిని ఏమంటారు?","నావికుడు / సారంగు"
"సంఘంలోవ్యక్తులు","500","ఈ చిత్రంలోని వ్యక్తి ఎవరు?","కుమ్మరి"
"శరీరభాగాలు","100","|120౧65 ను తెలుగులో పమంటారు?","చేతులు"
"శరీరభాగాలు","100","మనిషికి ఎన్ని చేతులు ఉంటాయి?","రెండు"
"శరీరభాగాలు","100","మనకు రుచి దేని వలన తెలుస్తుంది?","నాలుక"
"శరీరభాగాలు","100","లంగ్స్‌ ని తెలుగులో ఏమంటారు?","ఊపిరితిత్తులు / శ్వాసకోశాలు"
"శరీరభాగాలు","100","సూర్యుడిని నేరుగా చూడటం వల్ల ఏ అవయవం దెబ్బతింటుంది?","కళ్ళు"
"శరీరభాగాలు","100","గాలి పీల్చుకోవటానికి / వాసన చూడటానికి ఏ శరీరభాగం కావాలి?","ముక్కు"
"శరీరభాగాలు","100","మెడకి ఇంకో పేరు ఏమిటి?","కంఠం / గ్రీవము"
"శరీరభాగాలు","100","ఏ శరీర భాగంతో రుచి చూస్తాము?","నాలుక"
"శరీరభాగాలు","200","నువ్వు వేటితో చూడగలవు?","కళ్ళతో"
"శరీరభాగాలు","200","మనిషికి ఎన్నికాళ్ళు ఉంటాయి?","రెండు"
"శరీరభాగాలు","200","శిరము అంటే ఏ శరీర భాగము?","తల"
"శరీరభాగాలు","200","శిరముకి ఇంకొక పేరు చెప్పండి?","తల"
"శరీరభాగాలు","200","చేది, తీపి తేడా చెప్పే శరీరభాగం ఏమిటి?","నాలుక"
"శరీరభాగాలు","300","|9206 ను తెలుగులో పమంటారు?","ముఖము"
"శరీరభాగాలు","300","మనిషి గుండె ఏ వైపు ఉంటుంది?","ఎడమ వైపు"
"శరీరభాగాలు","300","కర్ణము అంటే ఏ శరీర భాగము?","చెవి"
"శరీరభాగాలు","300","ఆలోచనకి కేంద్రమైన శరీరభాగం ఏది?","మెదడు"
"శరీరభాగాలు","400","చెప్పులు దేనికి వేసుకుంటావు?","కాళ్ళకు"
"శరీరభాగాలు","400","మనిషికి చేతులకు మొత్తం ఎన్నివేళ్ళు ఉంటాయి?","పదివేళ్ళు"
"శరీరభాగాలు","400","5%! ని తెలుగులో ఏమని అంటారు?","పుర్రె / కపాలము"
"శరీరభాగాలు","500","వ్రాయడానికి కలాన్ని దేనితో పట్టుకొంటావు?","చేతితో / చేతివేళ్ళతో"
"శరీరభాగాలు","500","మనిషి గాలి పీలడానికి ఉపయోగపడే అవయవము ఏమిటి?","ముక్కు"
"శరీరభాగాలు","500","పాదం వెనుక భాగాన్ని పమంటారు?","మడమ"
"శరీరభాగాలు","500","చెవికి కమ్మలు లేదా కుండలాలు పెట్టుకునే భాగాన్ని పమంటారు?","తమ్మె"
"శరీరభాగాలు","500","వద్దాణము పెట్టుకునే శరీర భాగాన్ని పమంటారు?","నడుము"
