"Category","Marks","Question","Answer"
"శరీరం","100","దుర్గంధాన్ని తెలియజేసే శరీరభాగం ఏది?","ముక్కు"
"శరీరం","200","అభయం లేక దీవెన ఇవ్వడానికి వాడే శరీరభాగం ఏది?","చేయి/హస్తం"
"శరీరం","300","పారాణి పెట్టుకునే భాగం ఏది?","పొదం"
"శరీరం","400","₹4106/064110515 వ్యాధిని తెలుగులో ఏమంటారు?","క్షయ వ్యాధి"
"శరీరం","500","ఈ బొమ్మ లో సూచించిన అవయవాన్ని తెలుగులో ఏమంటారు?","మూత్రపిండం"
"వ్యాకరణము","100","నామవాచకములో నామము అంటే ఏమిటి?","పేరు"
"వ్యాకరణము","100","నామవాచకములకు బదులుగా వాడే పదాలను ఏమని అంటారు?","సర్వనామములు"
"వ్యాకరణము","100","అచ్చులు 'అ' తో మొదలై, ఏ అక్షరంతో ముగుస్తాయి?","'అః'"
"వ్యాకరణము","100","వాక్యములో ప్రధాన భాగాలు ఏవి?","కర్త, కర్మ"
"వ్యాకరణము","100","గ,గా,గి, గీ... తరువాత ఏ రెండు గుణింతాలు వస్తాయి?","గు, గూ"
"వ్యాకరణము","100","బుద్ధిమంతురాలు అనేది ఏ లింగము?","స్త్రీలింగము"
"వ్యాకరణము","100","గత మూడు మాట్లాట పోటీలు విజయవంతంగా జరిగాయి. ఇది ఏ కాలం?","భూతకాలం"
"వ్యాకరణము","100","అలా ఎవరు చూస్తారు? ఇందులో 'ఎవరు' అనేది ఏ భాషా భాగం?","సర్వనామము"
"వ్యాకరణము","100","పూసలు కి ఏకవచనం ఏమిటి?","పూస"
"వ్యాకరణము","100","క్రింద కి వ్యతిరేకపదం ఏమిటి?","పైన"
"వ్యాకరణము","100","జామపండు కు బహువచనం ఏమిటి?","జామపళ్ళు"
"వ్యాకరణము","200","నా పుస్తకం చిరిగి పోయింది. ఈ వాక్యంలో 'పుస్తకం' ఏ వచనం లో ఉంది?","ఏకవచనం"
"వ్యాకరణము","200","క్రియకు ఎన్ని కాలాలు ఉన్నాయి?","మూడు (3) కాలాలు"
"వ్యాకరణము","200","తిను అనే పదము ఎటువంటి భాషాభాగము?","క్రియ"
"వ్యాకరణము","200","పాపాలు కు ఏకవచనం చెప్పండి.","పాపం"
"వ్యాకరణము","200","చెట్లను సూచించే లింగము ఏమిటి?","నపుంసక లింగము"
"వ్యాకరణము","200","కూతురుకి బహువచనం చెప్పండి.","కూతుళ్ళు"
"వ్యాకరణము","200","చిన్న అనే పదానికి వ్యతిరేకపదం ఏమిటి?","పెద్ద"
"వ్యాకరణము","200","ఇప్పుడు తిరకాటం ఆడుతున్నాను. ఈ వాక్యం ఏ కాలంలో ఉంది?","వర్తమాన కాలంలో"
"వ్యాకరణము","300","మనుష్యులు - ఏకవచనం ఏమిటి?","మనిషి"
"వ్యాకరణము","300","రాముడు మంచి బాలుడు, అతడు పెద్దల మాట వింటాడు. ఈ వాక్యంలో సర్వనామము గుర్తించండి.","అతడు"
"వ్యాకరణము","300","నష్టం అనే పదానికి వ్యతిరేకపదం ఏమిటి?","లాభం"
"వ్యాకరణము","300","నిన్న అన్నం తిన్నాను. ఈ వాక్యాన్ని భవిష్యత్‌ కాలంలో చెప్పండి.","రేపు అన్నం తింటాను"
"వ్యాకరణము","300","త్రాగి, తిని, పాడుతూ, వెళ్తూ అనే క్రియలు ఏ రకం క్రియలు?","అసమాపక క్రియలు"
"వ్యాకరణము","400","కొడుకు కి స్త్రీలింగము ఏమిటి?","కూతురు"
"వ్యాకరణము","400","మొన్న, అటుమొన్న పదాలు ఏ కాలాన్ని సూచిస్తాయి?","భూతకాలం"
"వ్యాకరణము","500","దేవుడు కి బహువచనం ఏమిటి?","దేవుళ్ళు"
"వ్యాకరణము","500","సర్వనామాలను వేటికి బదులుగా వాడతారు?","నామవాచకాలకు"
"వ్యాకరణం","100","'చీకటి' కి వ్యతిరేక పదం చెప్పండి.","'వెలుతురు / వెలుగు'"
"వ్యాకరణం","100","విద్య వలన జ్ఞానం వస్తుంది. ఇందులో ఉన్న విభక్తి ఏది?","పంచమీ విభక్తి"
"వ్యాకరణం","100","'భలే, ఎంత బాగా చేసావు!' - ఈ వాక్యంలో అవ్యయం గుర్తించండి.","'భలే'"
"వ్యాకరణం","200","ఒక హల్లుకి అదే హల్లు ఒత్తుగా వస్తే ఆ అక్షరాన్ని ఏమంటారు?","ద్విత్వాక్షరం"
"వ్యాకరణం","200","పుంలింగం, స్త్రీలింగం, నపుంసకలింగం కి వేరే పేర్లు ఏమిటి?","మహాద్వాచకం, మహాతీవాచకం, అమహద్వాచకం"
"వ్యాకరణం","200","'జల్లు చల్లగా ఉంది' - ఈ వాక్యంలో విశేషణానికి వ్యతిరేక పదం ఏమిటి?","వేడిగా"
"వ్యాకరణం","300","'వచ్చాడు' అనే క్రియను భవిష్యత్ కాలం, బహువచనం లో మార్చి చెప్పండి.","'వస్తాడు, వస్తారు'"
"వ్యాకరణం","300","'నేను ఇంట్లో లేను' - ఈ వాక్యంలో విభక్తి ప్రత్యయం గుర్తించండి.","'ఇంట్లో' అనగా షష్టీవిభక్తి"
"వ్యాకరణం","300","'నువ్వు ఇక్కడికి రాగ?' ఈ వాక్యాన్ని కర్త లేకుండా మార్చండి.","'ఇక్కడికి రాగ?'"
"వ్యాకరణం","400","'అల్లం అంటే నాకు తెలీదా బెల్లంలా పుల్లగా ఉంటుందన్నాడట' - ఈ వాక్యంలో నామవాచకాలు, విశేషణాలు గుర్తించండి.","నామవాచకాలు: అల్లం, బెల్లం; విశేషణం: పుల్లగా"
"వ్యాకరణం","400","'సపర్హులు' - ఏ సంధి?","సవర్హులు = సవర్హ + ఉలు (సవర్హ సంధి)"
"వ్యాకరణం","400","ఈ బొమ్మలో అన్నింటిని కలిపి ఏమని అంటారు?","విరామ చిహ్నాలు"
"వ్యాకరణం","500","'మహర్షి' ని విడదీసి ఏ సంధి చెప్పండి.","మహా + ఋషి = మహర్షి (గుణసంధి)"
"వ్యాకరణం","500","'ఇప్పుడు తింటున్న అన్నం రేపు జీర్ణం అవుతుంది.' - ఈ వాక్యంలో 'తింటున్న' ఏ భాషా భాగం?","క్రియాజన్య విశేషణం"
"వ్యాకరణం","500","'అనూష ఇప్పుడు చేస్తున్న ఇంటిపని చాలా కష్టమైనది.' - 'చేస్తున్న' ఎటువంటి విశేషణం?","క్రియాజన్య విశేషణం"
"వేమనపద్యాలు","100","ఉప్పు, కర్పూరం ఏ రంగులో ఉంటాయి?","ఉప్పు, కర్పూరం తెలుపు రంగులో ఉంటాయి."
"వేమనపద్యాలు","100","ఈగకి జో కొడితే ఏమవుతుంది?","ఈగకి జో కొడితే జోరీగ అవుతుంది."
"వేమనపద్యాలు","100","వేమన ఒక పద్యంలో ఉప్పును ఏ వస్తువుతో పోల్చాడు?","వేమన ఉప్పును కర్పూరంతో పోల్చాడు."
"వేమనపద్యాలు","100","సజ్జనుడు ఎలా పలుకుతాడు?","సజ్జనుడు చల్లగా పలుకుతాడు."
"వేమనపద్యాలు","100","పుట్టలోని చెదలు గిట్టవా?","పుట్టలోని చెదలు గిట్టవా."
"వేమనపద్యాలు","100","'అనగ ననగ రాగ మతిశయిల్లుచునుండు... తీయనుండు' ఈ పద్యాన్ని పూరించండి.","'అనగ ననగ రాగ మతిశయిల్లుచునుండు... తీయనుండు... విశ్వదాభిరామ వినుర వేమ'"
"వేమనపద్యాలు","200","'మేడిపండు చూడ మేలిమై యుండును' ఈ పద్యాన్ని పూరించండి.","మేడిపండు చూడ మేలిమై యుండును."
"వేమనపద్యాలు","200","మేడిపండు పొట్ట విప్పితే ఏం ఉంటుంది?","మేడిపండు పొట్ట విప్పితే పురుగులు ఉంటాయి."
"వేమనపద్యాలు","200","వేమన పద్యాలలో చివరగా వచ్చే 'వినుర వేమ' పదానికి ముందర వచ్చే పదం ఏమిటి?","విశ్వదాభిరామ."
"వేమనపద్యాలు","200","తప్పులెన్నువారు తమ తప్పు ఎరుగరు.','తప్పులెన్నువారు తమ తప్పు ఎరుగరు."
"వేమనపద్యాలు","300","ఇరుమారు అంటే ఏమిటి?","ఇరుమారు అంటే రెండుసార్లు."
"వేమనపద్యాలు","300","అన్ని దానములలో ఏ దానము గొప్పది అని వేమన అంటారు?","అన్ని దానములలో అన్నదానం గొప్పది."
"వేమనపద్యాలు","400","'విశ్వదాభిరామ వినుర వేమ'లో దాగి ఉన్న అమ్మాయి పేరు ఏమిటి?","విశ్వద."
"వేమనపద్యాలు","400","ఆత్మ శుద్దిలేని యాచార మదియేల... ఈ పద్యం పూర్తి చేయండి.","ఆత్మ శుద్దిలేని యాచార మదియేల, భాండ శుద్దిలేని పాకమేల, చిత్తశుద్దిలేని శివపూజలేలరా, విశ్వదాభిరామ వినుర వేమ."
"వేమనపద్యాలు","500","మట్టిచెట్టును ఇంగ్లీషులో ఏమంటారు?","'మట్టిచెట్టు' ఇంగ్లీషులో 'Clay Tree'."
"వేమనపద్యాలు","500","వేమన శతకం మకుటం ఏమిటి?","విశ్వదాభిరామ వినుర వేమ."
"వేమనపద్యాలు","500","నీళ్ళలోని మొసలి బయటకు వస్తే దేనిచేత ఓడింపబడుతుందని వేమన అన్నాడు?","నీళ్ళలోని మొసలి కుక్క చేత ఓడింపబడుతుందని వేమన అన్నాడు."
"వేమనపద్యాలు","500","'చిక్కియున్న వేళ సింహంబునైనను...' ఈ పద్యాన్ని పూరించండి.","'చిక్కియున్న వేళ సింహంబునైనను, బక్కకుక్క కరచి బాధచేయు, బలిమిలేనివేళ పంతము చెల్లదు...'"
"వేమన","100","వేమన శతకమును రాసినవారు ఎవరు?","వేమన శతకమును రాసినవారు యోగి వేమన."
"వేమన","100","రుచులు చూడ వేరు.","రుచులు చూడ జాడ వేరు."
"వేమన","200","సజ్జనుడు పల్కు ఎలా ఉంటుంది?","సజ్జనుడు పల్కు చల్లగా ఉంటుంది."
"వేమన","200","ఎక్కడ అధికులం అనకూడదు?","అనువుగాని చోట అధికులం అనకూడదు."
"వేమన","300","పిరికివాడి మనసు, పండు రెండూ సమానం. ఈ పండును చెప్పండి.","పిరికివాడి మనసు, మేడి పండు రెండూ సమానం."
"వేమన","300","సాధనమున పనులు ఎలా జరుగుతాయి?","సాధనమున పనులు సమకూరు ధరలోన."
"వేమన","400","తల్లిదండ్రులు - ఇందులో ఉన్న రెండు పదాలు చెప్పండి.","తల్లి, తండ్రి."
"వేమన","400","మేడిపండు పొట్ట విప్పి చూస్తే ఏముంటాయి?","మేడిపండు పొట్ట విప్పి చూస్తే పురుగులు ఉంటాయి."
"వేమన","500","పట్టు పట్టరాదు, ____ విడువరాదు. ఖాళీని పూరించండి.","పట్టు పట్టరాదు, పట్ల విడువరాదు."
"వేమన","500","కంచు మ్రైగునట్లు కనకంబు మ్రైగునా.","కంచు మ్రైగునట్లు కనకంబు మ్రైగునా."
"వృత్తులు","100","పొలం దున్ని పంటలు పండించే వ్యక్తి ఎవరు?","పొలం దున్ని పంటలు పండించే వ్యక్తి రైతు."
"వృత్తులు","100","సినిమా ప్రొడ్యూసర్‌ని తెలుగులో ఏమంటారు?","సినిమా ప్రొడ్యూసర్‌ని తెలుగులో సినీ నిర్మాత/నిర్మాత అంటారు."
"వృత్తులు","200","బట్టలు కుట్టే వ్యక్తిని ఏమంటారు?","బట్టలు కుట్టే వ్యక్తిని దర్జీ అంటారు."
"వృత్తులు","200","ఈ బొమ్మలో యేసు క్రీస్తు చేస్తున్న వృత్తి పనిఏమిటి?","యేసు క్రీస్తు చేస్తున్న వృత్తి పనివడ్రంగి."
"వృత్తులు","300","సర్జన్‌ చేసే పనిని తెలుగులో ఏమంటారు?","సర్జన్‌ చేసే పనిని తెలుగులో శస్త్ర చికిత్స అంటారు."
"వృత్తులు","400","వడ్రంగి చేసే పని ఏమిటి?","వడ్రంగి చేసే పని కొయ్యపని (చక్క)"
"వృత్తులు","400","ఎడిటర్‌ని తెలుగులో ఏమంటారు?","ఎడిటర్‌ని తెలుగులో సంపాదకుడు/సంపాదకురాలు అంటారు."
"వృత్తులు","500","వ్యాధులు వస్తే తీర్చే వ్యక్తి ఎవరు?","వ్యాధులు వస్తే తీర్చే వ్యక్తి వైద్యుడు."
"వృత్తులు","500","పాండవుల అజ్ఞాతవాసంలో భీముడు ఏ వృత్తి చేసేవాడు?","పాండవుల అజ్ఞాతవాసంలో భీముడు వంటవాడిగా పనిచేసేవాడు."
"వృత్తిపనులు","100","ఆరోగ్యం బాగా లేకుంటే ఎవరి దగ్గరకు వెళ్తాము?","వైద్యుడు"
"వృత్తిపనులు","200","కంసాలి చేసే వస్తువులను ఏమంటారు?","నగలు/ఆభరణాలు"
"వృత్తిపనులు","300","దేశంలో శాంతి భద్రతలు కాపాడేవారు ఎవరు?","రక్షక భటులు/సైనికులు"
"వృత్తిపనులు","400","దర్జీ చేసే పని ఏమిటి?","బట్టలు కుట్టడం"
"వృత్తిపనులు","500","గికళంగ౧2౮1 ని తెలుగులో ఏమంటారు?","వ్యోమగామి / అంతరిక్ష యాత్రికుడు"
"వీంవరు","100","ఈ బొమ్మలోని వ్యక్తి ఎవరు?","భారత ప్రధాన మంత్రి శ్రీ నరేంద్ర మోడీ గారు"
"వీంవరు","200","ఈ గుర్తుని సూచిస్తున్న సంస్థని స్థాపించిన వారి పేరు చెప్పరెడి","శ్రీ స్టీవ్ జాబ్స్ / శ్రీ స్టీవ్ వోజ్నియాక్ / శ్రీ రోనాల్డ్ వేన్"
"వీంవరు","300","ఈ బొమ్మలోని విగ్రహం ఎవరది?","శ్రీ అల్లూరి సీతారామరాజు గారు"
"వీంవరు","400","అమెరికా దేశ 'ప్రథాన మహిళ' ఎవరు?","శ్రీమతి మిషెల్‌ ఒబామా గారు"
"వీంవరు","500","'జో అచ్యుతానంద జో జో ముకుందా' అనే పాటను కూర్చిన వాగ్గేయకారుడు ఎవరు?","శ్రీ తాళ్ళపాక అన్నమాచార్య / అన్నమయ్య"
"విషయపరిజ్ఞానం","100","ఆ౧|1696 562099 ౦0 ఉిగ69/౧102 ని తెలుగులో ఏమంటారు?","ఆగ౧169ర6 56121699 ౦0 శీిగ6౧102 ని తెలుగులో అమెరికా సంయుక్త రాష్ట్రాలు అంటారు"
"విషయపరిజ్ఞానం","200","పిల్లలను నిద్రపుచ్చడానికి పాడే పాటలను ఏమంటారు?","పిల్లలను నిద్రపుచ్చడానికి పాడే పాటలను జోల/లాలి పాటలు అంటారు"
"విషయపరిజ్ఞానం","300","కూచిపూడి నాట్యానికి ఆద్యుడు ఎవరు?","కూచిపూడి నాట్యానికి ఆద్యుడు సిద్ధేంద్రయోగి"
"విషయపరిజ్ఞానం","400","తగవులాడుకునేవారి మధ్య రాజీ కుదిర్దేవారిని ఏమంటారు?","తగవులాడుకునేవారి మధ్య రాజీ కుదిర్దేవారిని మధ్యవర్తి అంటారు"
"విషయపరిజ్ఞానం","500","ప్రముఖ తెలుగు చిత్రకారుడు 'బాపు' అసలు పేరు ఏమిటి?","చిత్రకారుడు 'బాపు' అసలు పేరు సత్తిరాజు వెంకట లక్ష్యినారాయణ"
"వాహనాలు","100","ఆకాశ మార్గాన ప్రయాణం చేయాలంటే ఏ వాహనంలో వెళ్తాము?","ఆకాశ మార్గాన ప్రయాణం చేయాలంటే విమానంలో ఎళ్తాము"
"వాహనాలు","200","ఏ ఇంధనం కానీ, జంతువు కానీ అవసరం లేకుండా నడిచే వాహనం ఒకటి చెప్పండి? (ఆంగ్లములో చెప్పవచ్చు)","సైకిలు/రిక్షా/స్కూటరు"
"వాహనాలు","300","నౌకలు/ఓడలు ఆగే ప్రదేశాన్ని ఏమంటారు?","నౌకలు/ఓడలు ఆగే ప్రదేశాన్ని ఓడ రేవు/రేవు/నౌకాశ్రయము అంటారు"
"వాహనాలు","400","ఈ మధ్య కాలం లో టైటానిక్‌ నౌకను చూడడానికి వెళ్తూ, సముద్రంలో పేలిపోయిన ‘టైటన్’ ఎటువంటి వాహనం?","టైటన్‌ ఒక జలాంతరామి."
"వాహనాలు","500","5024206 ౫ సంస్థ ఎటువంటి వాహనాలని తయారు చేస్తుంది?","5024206 ౫ సంస్థ వ్యోమ నౌకలు/అంతరిక్ష నౌకలు తయారు చేస్తుంది"
"వారాలు","100","ఇవాళ ఏ వారము?","ఇవాళ (ఆట ఆడే రోజు వారం చెప్పాలి)"
"వారాలు","200","'గుడ్‌ ఫ్రైడే' ఏ వారం వస్తుంది?","'గుడ్‌ ఫ్రైడే' శుక్రవారం వస్తుంది"
"వారాలు","300","ఈ రోజు మంగళవారం అయితే ఎల్లుండి ఏ పవారం?","ఈ రోజు మంగళవారం అయితే ఎల్లుండి గురువారం"
"వారాలు","400","వారాంతం అయిపోయిన తరువాత మొదటి రోజు ఏమిటి?","వారాంతం అయిపోయిన తరువాత మొదటి రోజు సోమవారం"
"వారాలు","500","ఒక సంవత్సరంలో ఎన్ని వారాలుంటాయి?","ఒక సంవత్సరంలో 52 వారాలుంటాయి"
"వారాలు-నెలలు","100","రోజుకి ఎన్ని గంటలు?","రోజుకి ఇరవై నాలుగు గంటలు"
"వారాలు-నెలలు","100","వారానికి ఎన్ని శనివారాలు ఉంటాయి?","వారానికి ఒకే ఒక్క శనివారం ఉంటుంది"
"వారాలు-నెలలు","100","నిన్నకు నిన్నని ఏమని పిలుస్తారు?","నిన్నకు 'మొన్న' అని పిలుస్తారు"
"వారాలు-నెలలు","100","ఈ ఏడాది జూన్ 5 బుధవారం అయితే, జూన్ 6 ఏ వారం?","ఈ ఏడాది జూన్ 5 బుధవారం అయితే, జూన్ 6 గురువారం"
"వారాలు-నెలలు","100","పౌర్ణమి నుంది అమావాస్య వరకు వుండే 15 రోజులను ఏ పక్షం అని అంటారు?","పౌర్ణమి నుంది అమావాస్య వరకు వుండే 15 రోజులను కృష్ణ పక్షం అని అంటారు"
